{
  "schema": "srp.tool.v1",
  "tool_id": "tool_018f0f4a-5c00-4000-8000-000000000001",
  "project_id": "project_018f0f4a-5c00-4000-8000-000000000001",
  "revision": 1,
  "supersedes_revision": null,
  "state": "published",
  "name": "Reference interval evaluator",
  "description": "A deterministic workflow for evaluating the declared interval.",
  "tool_kind": "workflow",
  "version": "1.0.0",
  "runtime": "oci:evimesh/interval-evaluator@sha256:abc",
  "input_schema_uri": "https://example.org/schema/evaluator-input-v1.json",
  "output_schema_uri": "https://example.org/schema/evaluator-output-v1.json",
  "license": "Apache-2.0",
  "provenance": "Built from the signed reference implementation.",
  "artifact_ref": { "kind": "artifact", "id": "artifact_018f0f4a-5c00-4000-8000-000000000002", "revision": 1 },
  "created_at": "2026-08-30T06:00:00.000Z",
  "created_by": "actor_01"
}
